<?xml version="1.0"?>
<!DOCTYPE JobDefinition SYSTEM "jd2.dtd">
<JobDefinition>
  <!-- "job1" コマンド"command1"を起動するジョブ -->
  <Job name="job1" scriptPath="/home/insight/bin/command1">
    <Arg>arg1</Arg>
    <Arg>arg2</Arg>
  </Job>
  <!-- "job2" コマンド"command2"を起動するジョブ -->
  <Job name="job2" scriptPath="/path/to/command2"/>
  <!-- "job3" スタティックメソッド 'SampleJob.exec("test")' を起動するメソッド -->
  <Job name="job3" javaClass="com.insight_tec.pi.sample.SampleJob" javaMethod="exec">
  	<Arg>test</Arg>
  </Job>
  <!-- "Job4" OSGiサービス "SampleService"のexecメソッドを実行するジョブ -->
  <Job name="Job4" osgiService="objectclass='com.insight_tec.pi.sample.SampleService'" javaMethod="exec"/>
  <!-- "Job5" コマンド"command5"を実行するジョブ -->
  <Job name="Job5" scriptPath="/path/to/command5"/>
  <!-- "trigger1" 毎分0秒にジョブ("Job1")をキックするトリガ -->
  <Trigger forJobName="job1" name="trigger1" at="0 * * * * ?"/>
  <!--  "trigger2" 全定義が読まれたあと即座にジョブをキックするトリガ -->
  <Trigger name="trigger2" at="now"/>
  <!-- "trigger2" を "job2"に割り当て -->
  <AssignTrigger trigger="trigger2" job="job2"/>
  <!-- ジョブネット"jobnet1" -->
  <JobNet name="jobnet1" enabled="true">
  	<!-- "pseudo1" JobNet外部から割込みを入れるための擬似要素 -->
    <Pseudo name="pseudo1"/>
    <!-- "job3"と接続する強制実行端末要素 -->
    <Terminal type="force" forJobName="job3">
    	<Predecessors>
    		<!-- 先行要素 "and2" へのリファレンス -->
	      <Predecessor name="and2"/>
		</Predecessors>
    </Terminal>
    <!-- "and1" ANDオペレータ -->
    <Operator type="and" name="and1">
    	<Predecessors>
    		<!-- 先行要素 "job1" へのリファレンス -->
	      <Predecessor name="job1"/>
	      <!-- 先行要素 "job2"へのリファレンス -->
	      <Predecessor name="job2"/>
      </Predecessors>
    </Operator>
    <!-- "or1" OR オペレータ -->
    <Operator type="or" name="or1">
    	<Predecessors>
    		<!-- 先行ジョブ"job4"へのリファレンス -->
	      <Predecessor name="job4"/>
	      <!-- 先行ジョブ"job5"へのリファレンス -->
	      <Predecessor name="job5"/>
	      <!-- 先行ジョブ"pseudo1"へのリファレンス -->
	      <Predecessor name="pseudo1"/>
      	</Predecessors>
    </Operator>
    <!-- "And2" Andオペレータ -->
    <Operator type="and" name="and2">
    	<Predecessors>
    		<!-- 先行要素 "and1"へのリファレンス -->
	      <Predecessor name="and1"/>
	      <!-- 先行要素"or1"へのリファレンス -->
	      <Predecessor name="or1"/>
		</Predecessors>
    </Operator>
  </JobNet>
  <!-- ジョブネット"jobnet2" -->
  <JobNet name="jobnet2" enabled="true">
  	<!-- "pseudo1" ジョブネット外部から割込みを入れるための擬似要素 -->
    <Pseudo name="pseudo1"/>
    <!-- "job3"と接続する強制実行端末要素、10秒ディレイ付き -->
    <Terminal type="force" forJobName="job3" delay="10000">
    	<Predecessors>
    		<!-- 先行要素 "counter1" へのリファレンス -->
	      <Predecessor name="counter1"/>
      	</Predecessors>
    </Terminal>
    <!-- "counter1" カウンタオペレータ要素、カウント数=10 -->
    <Operator type="counter" name="counter1" count="10">
    	<Predecessors>
    		<!-- 先行要素"not1"へのリファレンス -->
	      <Predecessor name="not1"/>
      <!-- <Predecessor name="pseudo1" option="position=1"/> -->
      </Predecessors>
    </Operator>
    <!-- "not1" NOTオペレータ要素 -->
    <Operator type="not" name="not1">
    	<Predecessors>
    		<!-- 先行要素"job3"へのリファレンス -->
      		<Predecessor name="job3"/>
		</Predecessors>
    </Operator>
  </JobNet>
  <!-- "class1" ジョブクラス 同時実行数=1 -->
  <JobClass name="class1" concurrency="1" maxruntime="" maxwaittime=""/>
  <!-- ジョブ "job1" をジョブクラス "class1"へ割当 -->
  <AssignJobClass forJobName="job1" class="class1"/>
  <!-- ジョブ "job2" をジョブクラス "class1"へ割当 -->
  <AssignJobClass forJobName="job2" class="class1"/>
  <!-- ジョブ "job3" をジョブクラス "class1"へ割当 -->
  <AssignJobClass forJobName="job3" class="class1"/>
  
</JobDefinition>
