<?xml version="1.0"?>
<!DOCTYPE JobDefinition SYSTEM "jd2.dtd">
<JobDefinition>
  <Job name="job1" scriptPath="/path/to/command1">
    <Arg>arg1</Arg>
    <Arg>arg2</Arg>
  </Job>
  <Job name="job2" scriptPath="/path/to/command2"/>
  <Job name="job3" javaClass="com.insight_tec.pi.sample.SampleJob" javaMethod="exec">
  	<Arg>test</Arg>
  </Job>
  <Job name="Job4" osgiService="objectclass='com.insight_tec.pi.sample.SampleService'"/>
  <Job name="Job5" scriptPath="/path/to/command5"/>
  <Trigger forJobName="job1" name="trigger1" at="0 * * * * ?"/>
  <Trigger name="trigger2" at="now"/>
  <AssignTrigger trigger="trigger2" job="job2"/>
  <JobNet name="one" enabled="true">
    <Pseudo name="pseudo1"/>
    <Terminal type="force" forJobName="job3">
    	<Predecessors>
	      <Predecessor name="and2"/>
	      <Operator type="and">
	      	<Predecessors>
		        <Predecessor name="job1"/>
		        <Predecessor name="job2"/>
		        <Operator type="or">
		        	<Predecessors>
			          <Predecessor name="job4"/>
			          <Predecessor name="job5"/>
			          <Predecessor name="pseudo1"/>
					</Predecessors>
		        </Operator>
	        </Predecessors>
	      </Operator>
      </Predecessors>
    </Terminal>
  </JobNet>
  <JobNet name="two" enabled="true">
    <Pseudo name="pseudo1"/>
    <Terminal type="force" forJobName="job3" delay="10sec">
    	<Predecessors>
	      <Predecessor name="counter1"/>
	      <Operator type="counter" count="10">
	      	<Predecessors>
	        <Operator type="not">
	        	<Predecessors>
	          	<Predecessor name="job3"/>
	          </Predecessors>
	        </Operator>
	        </Predecessors>
	      </Operator>
      	</Predecessors>
    </Terminal>
  </JobNet>
  <JobClass concurrency="2" maxruntime="10min" maxwaittime="10min">
    <MemberJob name="job1"/>
    <MemberJob name="job2"/>
    <MemberJob name="job3"/>
    
  </JobClass>
  
</JobDefinition>
